{
  "document_id": "exv1-aaaaaaaaaaaaaaaaaaaaaaaaaaaaaaaaaaaaaaaaaaaaaaaaaaaaaaaaaaaaaaaa/document/deir_fixture",
  "expected_page_count": 222,
  "global_content_order_ids": [
    "exv1-aaaaaaaaaaaaaaaaaaaaaaaaaaaaaaaaaaaaaaaaaaaaaaaaaaaaaaaaaaaaaaaa/block/deir_fixture/blk000001",
    "exv1-aaaaaaaaaaaaaaaaaaaaaaaaaaaaaaaaaaaaaaaaaaaaaaaaaaaaaaaaaaaaaaaa/block/deir_fixture/blk000002",
    "exv1-aaaaaaaaaaaaaaaaaaaaaaaaaaaaaaaaaaaaaaaaaaaaaaaaaaaaaaaaaaaaaaaa/block/deir_fixture/blk000003",
    "exv1-aaaaaaaaaaaaaaaaaaaaaaaaaaaaaaaaaaaaaaaaaaaaaaaaaaaaaaaaaaaaaaaa/block/deir_fixture/blk000004",
    "exv1-aaaaaaaaaaaaaaaaaaaaaaaaaaaaaaaaaaaaaaaaaaaaaaaaaaaaaaaaaaaaaaaa/table/deir_fixture/tbl000001",
    "exv1-aaaaaaaaaaaaaaaaaaaaaaaaaaaaaaaaaaaaaaaaaaaaaaaaaaaaaaaaaaaaaaaa/block/deir_fixture/blk000005",
    "exv1-aaaaaaaaaaaaaaaaaaaaaaaaaaaaaaaaaaaaaaaaaaaaaaaaaaaaaaaaaaaaaaaa/figure/deir_fixture/fig000001",
    "exv1-aaaaaaaaaaaaaaaaaaaaaaaaaaaaaaaaaaaaaaaaaaaaaaaaaaaaaaaaaaaaaaaa/block/deir_fixture/blk000006",
    "exv1-aaaaaaaaaaaaaaaaaaaaaaaaaaaaaaaaaaaaaaaaaaaaaaaaaaaaaaaaaaaaaaaa/block/deir_fixture/blk000007"
  ],
  "sections": [
    {
      "id": "exv1-aaaaaaaaaaaaaaaaaaaaaaaaaaaaaaaaaaaaaaaaaaaaaaaaaaaaaaaaaaaaaaaa/section/deir_fixture/sec000001",
      "document_id": "exv1-aaaaaaaaaaaaaaaaaaaaaaaaaaaaaaaaaaaaaaaaaaaaaaaaaaaaaaaaaaaaaaaa/document/deir_fixture",
      "sequence": 1,
      "content_layer": "body",
      "section_kind": "synthetic_body_root",
      "semantic_level": null,
      "section_path_ids": [
        "exv1-aaaaaaaaaaaaaaaaaaaaaaaaaaaaaaaaaaaaaaaaaaaaaaaaaaaaaaaaaaaaaaaa/section/deir_fixture/sec000001"
      ],
      "parent_section_id": null,
      "heading_block_id": null,
      "ordered_child_ids": [
        "exv1-aaaaaaaaaaaaaaaaaaaaaaaaaaaaaaaaaaaaaaaaaaaaaaaaaaaaaaaaaaaaaaaa/block/deir_fixture/blk000001",
        "exv1-aaaaaaaaaaaaaaaaaaaaaaaaaaaaaaaaaaaaaaaaaaaaaaaaaaaaaaaaaaaaaaaa/block/deir_fixture/blk000002",
        "exv1-aaaaaaaaaaaaaaaaaaaaaaaaaaaaaaaaaaaaaaaaaaaaaaaaaaaaaaaaaaaaaaaa/section/deir_fixture/sec000003",
        "exv1-aaaaaaaaaaaaaaaaaaaaaaaaaaaaaaaaaaaaaaaaaaaaaaaaaaaaaaaaaaaaaaaa/section/deir_fixture/sec000005"
      ],
      "inference_method": "synthetic",
      "source_stable_item_key": null,
      "evidence_ref": null
    },
    {
      "id": "exv1-aaaaaaaaaaaaaaaaaaaaaaaaaaaaaaaaaaaaaaaaaaaaaaaaaaaaaaaaaaaaaaaa/section/deir_fixture/sec000002",
      "document_id": "exv1-aaaaaaaaaaaaaaaaaaaaaaaaaaaaaaaaaaaaaaaaaaaaaaaaaaaaaaaaaaaaaaaa/document/deir_fixture",
      "sequence": 2,
      "content_layer": "furniture",
      "section_kind": "synthetic_furniture_root",
      "semantic_level": null,
      "section_path_ids": [
        "exv1-aaaaaaaaaaaaaaaaaaaaaaaaaaaaaaaaaaaaaaaaaaaaaaaaaaaaaaaaaaaaaaaa/section/deir_fixture/sec000002"
      ],
      "parent_section_id": null,
      "heading_block_id": null,
      "ordered_child_ids": [
        "exv1-aaaaaaaaaaaaaaaaaaaaaaaaaaaaaaaaaaaaaaaaaaaaaaaaaaaaaaaaaaaaaaaa/block/deir_fixture/blk000007"
      ],
      "inference_method": "synthetic",
      "source_stable_item_key": null,
      "evidence_ref": null
    },
    {
      "id": "exv1-aaaaaaaaaaaaaaaaaaaaaaaaaaaaaaaaaaaaaaaaaaaaaaaaaaaaaaaaaaaaaaaa/section/deir_fixture/sec000003",
      "document_id": "exv1-aaaaaaaaaaaaaaaaaaaaaaaaaaaaaaaaaaaaaaaaaaaaaaaaaaaaaaaaaaaaaaaa/document/deir_fixture",
      "sequence": 3,
      "content_layer": "body",
      "section_kind": "semantic",
      "semantic_level": 1,
      "section_path_ids": [
        "exv1-aaaaaaaaaaaaaaaaaaaaaaaaaaaaaaaaaaaaaaaaaaaaaaaaaaaaaaaaaaaaaaaa/section/deir_fixture/sec000001",
        "exv1-aaaaaaaaaaaaaaaaaaaaaaaaaaaaaaaaaaaaaaaaaaaaaaaaaaaaaaaaaaaaaaaa/section/deir_fixture/sec000003"
      ],
      "parent_section_id": "exv1-aaaaaaaaaaaaaaaaaaaaaaaaaaaaaaaaaaaaaaaaaaaaaaaaaaaaaaaaaaaaaaaa/section/deir_fixture/sec000001",
      "heading_block_id": "exv1-aaaaaaaaaaaaaaaaaaaaaaaaaaaaaaaaaaaaaaaaaaaaaaaaaaaaaaaaaaaaaaaa/block/deir_fixture/blk000003",
      "ordered_child_ids": [
        "exv1-aaaaaaaaaaaaaaaaaaaaaaaaaaaaaaaaaaaaaaaaaaaaaaaaaaaaaaaaaaaaaaaa/block/deir_fixture/blk000003",
        "exv1-aaaaaaaaaaaaaaaaaaaaaaaaaaaaaaaaaaaaaaaaaaaaaaaaaaaaaaaaaaaaaaaa/block/deir_fixture/blk000004",
        "exv1-aaaaaaaaaaaaaaaaaaaaaaaaaaaaaaaaaaaaaaaaaaaaaaaaaaaaaaaaaaaaaaaa/table/deir_fixture/tbl000001",
        "exv1-aaaaaaaaaaaaaaaaaaaaaaaaaaaaaaaaaaaaaaaaaaaaaaaaaaaaaaaaaaaaaaaa/section/deir_fixture/sec000004"
      ],
      "inference_method": "accepted_hierarchy_correction",
      "source_stable_item_key": "1111111111111111111111111111111111111111111111111111111111111111",
      "evidence_ref": {
        "path": "artifacts/decisions.jsonl",
        "sha256": "aaaaaaaaaaaaaaaaaaaaaaaaaaaaaaaaaaaaaaaaaaaaaaaaaaaaaaaaaaaaaaaa"
      }
    },
    {
      "id": "exv1-aaaaaaaaaaaaaaaaaaaaaaaaaaaaaaaaaaaaaaaaaaaaaaaaaaaaaaaaaaaaaaaa/section/deir_fixture/sec000004",
      "document_id": "exv1-aaaaaaaaaaaaaaaaaaaaaaaaaaaaaaaaaaaaaaaaaaaaaaaaaaaaaaaaaaaaaaaa/document/deir_fixture",
      "sequence": 4,
      "content_layer": "body",
      "section_kind": "semantic",
      "semantic_level": 3,
      "section_path_ids": [
        "exv1-aaaaaaaaaaaaaaaaaaaaaaaaaaaaaaaaaaaaaaaaaaaaaaaaaaaaaaaaaaaaaaaa/section/deir_fixture/sec000001",
        "exv1-aaaaaaaaaaaaaaaaaaaaaaaaaaaaaaaaaaaaaaaaaaaaaaaaaaaaaaaaaaaaaaaa/section/deir_fixture/sec000003",
        "exv1-aaaaaaaaaaaaaaaaaaaaaaaaaaaaaaaaaaaaaaaaaaaaaaaaaaaaaaaaaaaaaaaa/section/deir_fixture/sec000004"
      ],
      "parent_section_id": "exv1-aaaaaaaaaaaaaaaaaaaaaaaaaaaaaaaaaaaaaaaaaaaaaaaaaaaaaaaaaaaaaaaa/section/deir_fixture/sec000003",
      "heading_block_id": "exv1-aaaaaaaaaaaaaaaaaaaaaaaaaaaaaaaaaaaaaaaaaaaaaaaaaaaaaaaaaaaaaaaa/block/deir_fixture/blk000005",
      "ordered_child_ids": [
        "exv1-aaaaaaaaaaaaaaaaaaaaaaaaaaaaaaaaaaaaaaaaaaaaaaaaaaaaaaaaaaaaaaaa/block/deir_fixture/blk000005",
        "exv1-aaaaaaaaaaaaaaaaaaaaaaaaaaaaaaaaaaaaaaaaaaaaaaaaaaaaaaaaaaaaaaaa/figure/deir_fixture/fig000001"
      ],
      "inference_method": "accepted_hierarchy_correction",
      "source_stable_item_key": "3333333333333333333333333333333333333333333333333333333333333333",
      "evidence_ref": {
        "path": "artifacts/decisions.jsonl",
        "sha256": "aaaaaaaaaaaaaaaaaaaaaaaaaaaaaaaaaaaaaaaaaaaaaaaaaaaaaaaaaaaaaaaa"
      }
    },
    {
      "id": "exv1-aaaaaaaaaaaaaaaaaaaaaaaaaaaaaaaaaaaaaaaaaaaaaaaaaaaaaaaaaaaaaaaa/section/deir_fixture/sec000005",
      "document_id": "exv1-aaaaaaaaaaaaaaaaaaaaaaaaaaaaaaaaaaaaaaaaaaaaaaaaaaaaaaaaaaaaaaaa/document/deir_fixture",
      "sequence": 5,
      "content_layer": "body",
      "section_kind": "semantic",
      "semantic_level": 3,
      "section_path_ids": [
        "exv1-aaaaaaaaaaaaaaaaaaaaaaaaaaaaaaaaaaaaaaaaaaaaaaaaaaaaaaaaaaaaaaaa/section/deir_fixture/sec000001",
        "exv1-aaaaaaaaaaaaaaaaaaaaaaaaaaaaaaaaaaaaaaaaaaaaaaaaaaaaaaaaaaaaaaaa/section/deir_fixture/sec000005"
      ],
      "parent_section_id": "exv1-aaaaaaaaaaaaaaaaaaaaaaaaaaaaaaaaaaaaaaaaaaaaaaaaaaaaaaaaaaaaaaaa/section/deir_fixture/sec000001",
      "heading_block_id": "exv1-aaaaaaaaaaaaaaaaaaaaaaaaaaaaaaaaaaaaaaaaaaaaaaaaaaaaaaaaaaaaaaaa/block/deir_fixture/blk000006",
      "ordered_child_ids": [
        "exv1-aaaaaaaaaaaaaaaaaaaaaaaaaaaaaaaaaaaaaaaaaaaaaaaaaaaaaaaaaaaaaaaa/block/deir_fixture/blk000006"
      ],
      "inference_method": "accepted_hierarchy_correction",
      "source_stable_item_key": "6666666666666666666666666666666666666666666666666666666666666666",
      "evidence_ref": {
        "path": "artifacts/decisions.jsonl",
        "sha256": "aaaaaaaaaaaaaaaaaaaaaaaaaaaaaaaaaaaaaaaaaaaaaaaaaaaaaaaaaaaaaaaa"
      }
    }
  ],
  "content": [
    {
      "id": "exv1-aaaaaaaaaaaaaaaaaaaaaaaaaaaaaaaaaaaaaaaaaaaaaaaaaaaaaaaaaaaaaaaa/block/deir_fixture/blk000001",
      "record_type": "block",
      "content_layer": "body",
      "section_id": "exv1-aaaaaaaaaaaaaaaaaaaaaaaaaaaaaaaaaaaaaaaaaaaaaaaaaaaaaaaaaaaaaaaa/section/deir_fixture/sec000001",
      "sequence": 1,
      "semantic_placement": "pre_root",
      "is_toc_row": false,
      "stable_item_key": "0000000000000000000000000000000000000000000000000000000000000000"
    },
    {
      "id": "exv1-aaaaaaaaaaaaaaaaaaaaaaaaaaaaaaaaaaaaaaaaaaaaaaaaaaaaaaaaaaaaaaaa/block/deir_fixture/blk000002",
      "record_type": "block",
      "content_layer": "body",
      "section_id": "exv1-aaaaaaaaaaaaaaaaaaaaaaaaaaaaaaaaaaaaaaaaaaaaaaaaaaaaaaaaaaaaaaaa/section/deir_fixture/sec000001",
      "sequence": 2,
      "semantic_placement": "toc_content",
      "is_toc_row": true,
      "stable_item_key": "2222222222222222222222222222222222222222222222222222222222222222"
    },
    {
      "id": "exv1-aaaaaaaaaaaaaaaaaaaaaaaaaaaaaaaaaaaaaaaaaaaaaaaaaaaaaaaaaaaaaaaa/block/deir_fixture/blk000003",
      "record_type": "block",
      "content_layer": "body",
      "section_id": "exv1-aaaaaaaaaaaaaaaaaaaaaaaaaaaaaaaaaaaaaaaaaaaaaaaaaaaaaaaaaaaaaaaa/section/deir_fixture/sec000003",
      "sequence": 3,
      "semantic_placement": "heading_owner",
      "is_toc_row": false,
      "stable_item_key": "1111111111111111111111111111111111111111111111111111111111111111"
    },
    {
      "id": "exv1-aaaaaaaaaaaaaaaaaaaaaaaaaaaaaaaaaaaaaaaaaaaaaaaaaaaaaaaaaaaaaaaa/block/deir_fixture/blk000004",
      "record_type": "block",
      "content_layer": "body",
      "section_id": "exv1-aaaaaaaaaaaaaaaaaaaaaaaaaaaaaaaaaaaaaaaaaaaaaaaaaaaaaaaaaaaaaaaa/section/deir_fixture/sec000003",
      "sequence": 4,
      "semantic_placement": "direct_body",
      "is_toc_row": false,
      "stable_item_key": "4444444444444444444444444444444444444444444444444444444444444444"
    },
    {
      "id": "exv1-aaaaaaaaaaaaaaaaaaaaaaaaaaaaaaaaaaaaaaaaaaaaaaaaaaaaaaaaaaaaaaaa/table/deir_fixture/tbl000001",
      "record_type": "table",
      "content_layer": "body",